Id;N по каталогу;Категория;Название товара рус;Название товара eng;Объем;Родительский товар;Бренд;Линия;Цена закупки;Цена;Цена со скидкой;Артикул;Активность;Короткое описание;Поставщик;Страна производства;Изготовитель;Цвет через запятую
;719;Косметика;Лифтинг-крем ;SUPREME-DHE.Age LIFTING CREAM ;50;;ERICSON LABORATOIRE;SUPREME-DHE.Age;1285200;1671000;;Е739;;Мощный комплексный антивозрастной крем, созданный специально для зрелой кожи, которая уже испытала на себе возрастные изменения, связанные с гормональными изменениями.;;Франция;;
;720;Косметика;Крем Рич ;SUPREME-DHE.Age RICH CREAM ;50;;ERICSON LABORATOIRE;SUPREME-DHE.Age;1162800;1512000;;Е296;;Нежный крем с роскошным ароматом разработан специально для интенсивной борьбы со старением кожи. Благодаря входящим в его состав «молекуле молодости», полученной из дикого ямса, уникальным биокомплексам, ценным растительным маслам и фито-экстрактам он оказывает мощное омолаживающее воздействие на кожу, работая одновременно по трем направлениям: активно борется с морщинами, устраняет дряблость кожи и интенсивно питает ее. При этом крем имеет нежирную текстуру, великолепно впитывается. Он подходит для всех типов увядающей кожи, кроме жирной. ;;Франция;;
;721;Косметика;Интенсивная регенерирующая сыворотка ;SUPREME-DHE.Age CONCENTRATED SERUM ;30;;ERICSON LABORATOIRE;SUPREME-DHE.Age;1020000;1326000;;Е297;;Лечебная сыворотка применяется вместе с кремом, насыщает кожу активными веществами, необходимыми для ее регенерации, увлажнения и оксигенации. Биокомплекс из протеинов сладкого миндаля укрепляет и повышает тонус кожи, разглаживает микрорельеф и устраняет морщины. Раффермин обладает сильным омолаживающим действием, укрепляет опорные волокна, повышает упругость и плотность кожи. ;;Франция;;
;722;Косметика;Крем Лайт ;SUPREME-DHE.Age LIGHT CREAM ;50;;ERICSON LABORATOIRE;SUPREME-DHE.Age;1020000;1326000;;Е298;;Легкий, воздушный крем обладает мощным омолаживающим действием на кожу. Благодаря входящим в его состав «молекуле молодости» и уникальным биокомплексам он способствует обновлению клеток, усиливает синтез коллагена, предотвращает повреждение ДНК ультрафиолетовыми лучами, способствует устранению морщин, повышает тонус и эластичность кожи, смягчает и увлажняет ее. Крем имеет нежирную текстуру, великолепно впитывается. Может служить прекрасной основой под макияж. Он подходит для всех типов увядающей кожи.;;Франция;;
;723;Косметика;Очищающее молочко ;SUPREME-DHE.Age CLEANSING MILK ;200;;ERICSON LABORATOIRE;SUPREME-DHE.Age;448800;584000;;Е311;;Уже на стадии очищения молочко восстанавливает жизненные силы кожи, возвращая ей свежесть. Помимо дикого ямса, молочко содержит экстракты хвоща, плодов авокадо, лимона, грейпфрута и сосны, которые восстанавливают кожу, смягчают ее, действуют как антиоксиданты.;;Франция;;
;724;Косметика;Тоник увлажняющий ;SUPREME-DHE.Age MOISTURIZING TONER ;200;;ERICSON LABORATOIRE;SUPREME-DHE.Age;448800;584000;;Е313;;Тоник дополняет и завершает демакияж. Оживляет, тонизирует и освежает уставшую кожу. Экстракт авокадо насыщает кожу витаминами, биокомплекс фукогель 1000 глубоко увлажняет.;;Франция;;
;725;Косметика;Мини-кит Суприм DHE-Age (сыворотка, крем лайт, крем лифтинг);MINI-KIT SUPREME DHE-AGE;наб. 10+10+ 10;;ERICSON LABORATOIRE;SUPREME-DHE.Age;346800;451000;;D710;;;;Франция;;
;726;Косметика;Мультиактивный скраб глубокого дейсвия;"BOTU ""VIP"" WRINKLES TENSION RELEASE LINES RUB OUT ";50;;ERICSON LABORATOIRE;"BOTU ""VIP""";530400;690000;;Е773;;Скраб глубоко очищает и активизирует обновление клеток, способствуя проникновению активных ингредиентов в глубокие слои кожи. Оказывает антисептическое и антиоксидантное действие, нормализует микроциркуляцию, улучшает цвет лица и выравнивает рельеф кожи. Его нежный аромат превращает очищение в истинное удовольствие. ;;Франция;;
;727;Косметика;Активная сыворотка против морщин двойного действия;"BOTU ""VIP"" WRINKLES TENSION RELEASE DOUBLE SERUM ";10;;ERICSON LABORATOIRE;"BOTU ""VIP""";734400;955000;;Е504;;Благодаря входящим в состав препарата инновационным биокомплексам FILLOX® и SYN®-AKE сыворотка расслабляет мимические мышцы и уменьшает глубину морщин. Препарат содержит компоненты, моделирующие биологическое действие змеиного яда, поэтому его эффект наступает очень быстро и продолжается в течение нескольких суток. Сыворотка обогащена 5 мощными анти-эйджбиокомплексами и ее по праву можно назвать препаратом для «шоковой» терапии возрастных изменений кожи. ;;Франция;;
;728;Косметика;Питательный крем против морщин;"BOTU ""VIP"" WRINKLES TENSION RELEASE NOURISHING CREAM";50;;ERICSON LABORATOIRE;"BOTU ""VIP""";1183200;1539000;;Е742;;Этот инновационный, чрезвычайно насыщенный по составу препарат идеально подходит для всех типов увядающей кожи, склонной к образованию морщин. Ежедневное применение крема способствует расслаблению мимических мышц, разглаживанию морщин и складок. Препарат содержит компоненты, моделирующие биологическое действие змеиного яда, поэтому его эффект наступает очень быстро и продолжается значительное время. Благодаря входящим в его состав инновационным биокомплексам, ценным натуральным маслам и экстрактам целебных растений, этот крем эффективно борется со старением кожи, способствует восстановлению структуры дермы, интенсивно увлажняет, питает и смягчает кожу, даря ощущение необычайного комфорта и нежности. ;;Франция;;
;729;Косметика;Увлажняющий крем против морщин;"BOTU ""VIP"" WRINKLES TENSION RELEASE MOISTURIZING CREAM ";50;;ERICSON LABORATOIRE;"BOTU ""VIP""";1142400;1486000;;Е743;;Нежный крем с шелковистой, тающей текстурой создан специально для интенсивной борьбы с признаками старения и идеально подходит для ухода за нормальной и комбинированной кожей, склонной к образованию морщин. Ежедневное применение этого препарата способствует расслаблению мимических мышц, разглаживанию морщин и складок. Препарат содержит компоненты, моделирующие биологическое действие змеиного яда, поэтому его эффект наступает очень быстро и продолжается значительное время. Благодаря инновационным биокомплексам, входящим в его состав, крем стимулирует синтез структурных компонентов дермы, способствует повышению тонуса и эластичности кожи, восстанавливает овал лица, обладает мощным и длительным лифтинговым действием. Крем может служить идеальной основой под макияж.;;Франция;;
;730;Косметика;Энзимный ночной крем;"BOTU ""VIP"" WRINKLES TENSION RELEASE ENZYMATIC NIGHT CREAM ";50;;ERICSON LABORATOIRE;"BOTU ""VIP""";1162800;1512000;;Е744;;Крем оказывает мягкое отшелушивающее действие, способствует обновлению клеток кожи, активизирует клеточный метаболизм, улучшает цвет лица, питает, увлажняет и восстанавливает структуру эпидермиса. Уникальность этого крема состоит в том, что его активное действие продолжается еще в течение трех часов после нанесения. В домашнем уходе рекомендуется наносить крем вечером, тогда энзимы продолжают оказывать свое действие во время сна, и утром кожа выглядит обновленной и гладкой. Препарат также многократно усиливает действие сыворотки и кремов линии Боту «Вайп» наносимых на кожу утром. ;;Франция;;
;731;Косметика;"Мини-Кит BOTU ""VIP"" (энзимный ночной крем, увлажняющий крем, скраб)";"MINI-KIT BOTU ""VIP"" ";наб. 10+10+10;;ERICSON LABORATOIRE;"BOTU ""VIP""";346800;451000;;D702;;;;Франция;;
;732;Косметика;Очищающее молочко AQUA SOURCE ;HYDRA CLINIC AQUA SOURCE CLEANSING MILK;250;;ERICSON LABORATOIRE;HYDRA CLINIC;367200;478000;;E794;;Нежное бархатное молочко с освежающим ароматом деликатно очищает кожу, не повреждает гидро-липидную мантию и не нарушает баланса эпидермиса. Очищая, молочко великолепно смягчает кожу, дарит ей мягкость и чувство комфорта. Подходит для ежедневного ухода за сухой, обезвоженной и чувствительной кожей любого типа.;;Франция;;
;733;Косметика;Увлажняющий лосьон AQUA SOURCE ;HYDRA CLINIC AQUA SOURCE MOISTURIZING LOTION ;250;;ERICSON LABORATOIRE;HYDRA CLINIC;367200;478000;;E795;;Лосьон буквально оживляет сухую обезвоженную кожу. Насыщает ее влагой, тонизирует, смягчает и успокаивает. Препарат насыщен увлажняющими биокомплексами и экстрактами целебных растений, завершая этап очищения, готовит кожу к последующему нанесению косметических препаратов. ;;Франция;;
;734;Косметика;Влагоудерживающая сыворотка AQUAFIX MPC30;HYDRA CLINIC AQUAFIX MPC30 WATER FIXING SERUM ;30;;ERICSON LABORATOIRE;HYDRA CLINIC;775200;1008000;;E796;;Инновационная SOS сыворотка для мгновенного восстановления сухой обезвоженной кожи. Препарат обогащен необыкновенными компонентами, которые в зависимости от влажности окружающей среды меняют силу своего воздействия на кожу, захватывают и удерживают необходимое количество молекул воды, увлажняют кожу в течение 24 часов. Экстракты редких растений гилоцереуса и томарило, насыщают кожу витаминами С и Е, оказывают сосудоукрепляюее и омолаживающее действие. ;;Франция;;
;735;Косметика;Восстанавливающая сыворотка NUTRI FORCE C34;HYDRA CLINIC NUTRI FORCE C34 REPAIR SERUM ;30;;ERICSON LABORATOIRE;HYDRA CLINIC;775200;1008000;;E797;;Сыворотка является настоящим живительным эликсиром для сухой кожи, а также для кожи, пострадавшей от воздействия негативных внешних факторов (холод, ветер, солнечные лучи). Биокомплекс из экстракта татарника восстанавливает поврежденную кожу и формирует «нео-эпидермис», который защищает от вредного воздействия окружающей среды и повышает упругость кожи. Уникальная комбинация ценных растительных масел (аргании, фисташковое, марулы, гарцинии) восстанавливает липидный состав эпидермиса, смягчает, делает кожу нежной, мягкой и бархатистой. ;;Франция;;
;736;Косметика;Интенсивный увлажняющий крем AQUA VITAL MPC30 ;HYDRA CLINIC AQUA VITAL MPC30 CREAM ;50;;ERICSON LABORATOIRE;HYDRA CLINIC;754800;982000;;E798;;Изысканный препарат с благородным ароматом обладает экстраординарной увлажняющей способностью и идеально подходит для долговременного восстановления водного баланса кожи любого типа. Инновационные компоненты обладают удивительной способностью захватывать и удерживать молекулы воды в зависимости от влажности окружающей среды. Еще один новый компонент на основе природных полисахаридов и серина создает эффект «второй кожи», увлажняя и защищая кожу в течение длительного времени. Экстракты огурца, дыни и арбуза буквально напитывают кожу влагой, освежают и тонизируют. Крем с воздушной текстурой великолепно устраняет воспаление, шелушение, покраснение. Защищает клетки кожи от свободно-радикального окисления, успокаивает, смягчает, дарит ощущение мягкости и комфорта.;;Франция;;
;737;Косметика;Питательный крем  INTENSIVE REPAIR C34 ;HYDRA CLINIC INTENSIVE REPAIR C34 CREAM ;50;;ERICSON LABORATOIRE;HYDRA CLINIC;754800;982000;;E799;;Насыщенный по составу, но с легкой текстурой, питательный крем обогащен уникальными биокомпонентами, которые восполняют дефицит влаги и липидов в сухой коже, восстанавливают микроструктуру эпидермиса, укрепляет кожный барьер, обеспечивая защиту от перепадов температур. Богатый растительными маслами клюквы, ши, марулы и лавра крем интенсивно питает и смягчает кожу, улучшает регенерацию, успокаивает. Стимулируя выработку коллагена, препарат повышает тонус и эластичность кожи, активно замедляет старение. Крем идеально подходит для сохранения красоты и молодости сухой кожи, а так же для защиты кожи любого типа от неблагоприятных климатических условий (мороз, ветер, перепады температуры).;;Франция;;
;738;Косметика;Крем HYDRO PATCH H25 ;HYDRA CLINIC HYDRO PATCH H25 ;50;;ERICSON LABORATOIRE;HYDRA CLINIC;714000;929000;;E800;;Легкий увлажняющий крем является воплощением передовых научных исследований и создан для быстрого устранения обезвоженности кожи. Уникальные биокомпоненты меняют свою молекулярную структуру в зависимости от влажности воздуха, благодаря чему характер и сила лечебного воздействия препарата на кожу адаптируются к условиям окружающей среды. Крем буквально насыщает эпидермис молекулами воды и одновременно создает эффект «второй кожи», которая деликатно и комфортно предотвращает потерю драгоценной влаги в течение всего дня. Препарат с воздушной текстурой и нежным фруктовым ароматом улучшает внешний вид и состояние кожи, «стирая» все следы усталости и дает длительное ощущение свежести. Подходит для всех типов обезвоженной кожи и может служить идеальной основой под макияж.;;Франция;;
;739;Косметика;Флюид активное увлажнение  AQUAJET AQP-3;HYDRA CLINIC AQUAJET AQP-3 FLUID ;50;;ERICSON LABORATOIRE;HYDRA CLINIC;714000;929000;;E801;;Увлажняющий флюид мгновенно приносит облегчение обезвоженной, сухой, раздраженной коже. Не имеющие аналогов растительные биокомплексы воздействуют на все основные механизмы поддержания водного баланса, самоадаптируются к изменяющимся внешним условиям и создают в коже настоящее депо влаги. Морская вода из лагун Полинезии является источником многочисленных микро-, олиго- и макро-элементов, необходимых для здоровья кожи, стимулирует клеточный метаболизм, тонизирует и укрепляет кожу. Экстракт водного клевера содержит аскорбиновую кислоту, оказывает антиоксидантное и омолаживающее действие. Флюид подходит для ежедневного ухода за обезвоженной кожей всех типов и особенно комфортен в жаркое время года. За счет легкой консистенции он прекрасно впитывается не оставляя жирного блеска, создавая ощущение свежести в течение дня. ;;Франция;;
;740;Косметика;Восстанавливающий крем TOTAL NUTRITION RH30 ;HYDRA CLINIC TOTAL NUTRITION RH30 ;50;;ERICSON LABORATOIRE;HYDRA CLINIC;775200;1008000;;E802;;Насыщенный по составу крем восполняет недостаток липидов, интенсивно питает, смягчает и восстанавливает сухую кожу. Крем великолепно подходит для ухода за кожей шеи и декольте. После нанесения крема, на коже создается эффект «повязки», что способствует очень быстрому проникновению в кожу активных компонентов и мгновенному восстановлению эпидермального барьера. В качестве средства для регулярного ухода этот препарат предназначен для возрастной сухой кожи с недостатком собственных липидов. Комплекс натуральных растительных масел (фисташкового, марулы, гарцинии, аргании) великолепно защищает, увлажняет и питает кожу, оказывает регенерирующее действие и препятствует преждевременному старению, делает кожу мягкой и бархатистой. Кроме того, крем может использоваться для экстренной помощи в случае повреждения кожи (например, солнечный ожог, воздействие мороза и ветра и т.п.). ;;Франция;;
;741;Косметика;Крем для губ HYALURONIC 101;HYDRA CLINIC HYALURONIC 101;15;;ERICSON LABORATOIRE;HYDRA CLINIC;836400;1088000;;E803;;Безопасное увеличение губ без инъекций! Новый многофункциональный крем для комплексного ухода за губами позволяет добиться эффекта увеличения объема губ без инъекций, стимулирует синтез коллагена и активно борется со старением, на длительный период времени увлажняет кожу губ и обеспечивает защиту от вируса герпеса. Биокомплексы растительного происхождения мгновенно увлажняют, захватывая и удерживая молекулы воды, надолго сохраняя влагу в коже. Экстракт альпийской розы противодействует повреждающим фактором внешней среды, обладает противогерпетическим эффектом. Крем увеличивает объем губ, их контуры становятся более четкими, губы выглядят естественно, блестят и остаются мягкими, более чувственными и привлекательными. Препарат идеально подходит для повседневного ухода за губами в любом возрасте.;;Франция;;
