Id;N по каталогу;Категория;Название товара рус;Название товара eng;Объем;Родительский товар;Бренд;Линия;Цена закупки;Цена;Цена со скидкой;Артикул;Активность;Короткое описание;Поставщик;Страна производства;Изготовитель;Цвет через запятую
;1;Косметика;Гель очищающий минеральный для чувствительной нормальной/жирной кожи;Barbados Mineral Cleansing Gel ;200 мл;;Anna lotan;Barbados;254800;360000;;163;;(грязь Мертвого моря, экстракт водоросли ламинарии, масло облепихи, мочевина).   Хорошо очищает и обезжиривает кожу. ;;Израиль;;
;2;Косметика;Очищающая пенка;Barbados Foam Purifying Cleanse;125 мл;;Anna lotan;Barbados;321400;450000;;129;;(зеленый чай, глициновая и ундициленовая кислота, гидролизованный пшеничный протеин, вода Мертвого моря, экстракт жимолости). Нежнейшая очищающая пенка, на 100% состоящая из натуральных компонентов, в удобном диспенсере. ;;Израиль;;
;3;Косметика;Гидрофильное масло;Purifying Hydrophilic Cleanser;50 мл;;Anna lotan;Barbados;216800;305000;;080;;"(триглицериды масла сои, масло лаванды, розмарина, экстракт литоспермума, азулен). Может применяться самостоятельно для демакияжа глаз и губ, а также совместно с ""Коллагелем"" для очищения кожи всех типов.   ";;Израиль;;
;4;Косметика;Гидрофильное масло;Purifying Hydrophilic Cleanser;200 мл;080;Anna lotan;Barbados;285300;400000;;035;;"(триглицериды масла сои, масло лаванды, розмарина, экстракт литоспермума, азулен). Может применяться самостоятельно для демакияжа глаз и губ, а также совместно с ""Коллагелем"" для очищения кожи всех типов.   ";;Израиль;;
;5;Косметика;Лосьон для чувствительной нормальной/жирной кожи лица ;Facial Toner for delicate normal to oily skin;200 мл;;Anna lotan;Barbados;209200;295000;;020;;(алоэ, ромашка, азелаиновая кислота и экстракт огурца).Ежедневное использование лосьона поддерживает гигиены жирной и комбинированной кожи, сохраняя ее мягкость.;;Израиль;;
;6;Косметика;Лосьон для чувствительной нормальной/жирной кожи лица ;Facial Toner for delicate normal to oily skin;500 мл;020;Anna lotan;Barbados;289100;405000;;4020;;(алоэ, ромашка, азелаиновая кислота и экстракт огурца).Ежедневное использование лосьона поддерживает гигиены жирной и комбинированной кожи, сохраняя ее мягкость.;;Израиль;;
;7;Косметика;Био-тоник;Bio Toner;100 мл;;Anna lotan;Barbados;319500;450000;;051;;Успокаивающий биотоник для лица и кожи головы обладает смягчающими, успокаивающими свойствами. Для кожи головы препарат рекомендуется использовать после мытья специальным шампунем против перхоти.;;Израиль;;
;8;Косметика;"Натуральный отшелушивающий гель для деликатной кожи ""СКАЛЕКС"" ";Scalex;40 мл;;Anna lotan;Barbados;460200;645000;;073;;"(вода Мертвого моря, масла оливы, жожоба, макадамии, нони, экстракты лопуха и календулы, масло розы дамасской, пальмарозы и кокоса).  Натуральный отшелушивающий гель для проведения  пилинга  для деликатной,  склонной к жирности кожи. Может использоваться как самостоятельно, так и в качестве основы под ""био-пилинг"". ";;Израиль;;
;9;Косметика;Крем для жирной кожи;BARBADOS Delicate Oily Skin Balm;70 мл;;Anna lotan;Barbados;327100;460000;;078;;(натуральный сок алоэ, стеариновая кислота, очищенная фракция ланолина, сорбитол). Оказывает  успокаивающее, противозудное и противомикробное действие, нормализует активность сальных желез, отбеливает, представляет собой тонкую эмульсию, типа «масло-в-воде», для жирной, склонной к себорее кожи .;;Израиль;;
;10;Косметика;Бальзам для чувствительной кожи;Barbados Naturally Preserved Pure Balm;50 мл;;Anna lotan;Barbados;391800;550000;;144;;(натуральный сок алоэ, масло оливы и жожоба, cimicifuga (клопогон кистевидный), сквалан, экстракт жимолости, витамин Е, молочная кислота). Натуральная эмульсия мгновенно впитывается, успокаивает и увлажняет раздражённую кожу (особенно в Т-зоне) благодаря специально подобранным ингредиентам, максимально защищают кожу от свободных радикалов. Препарат содержит только натуральные консерванты.;;Израиль;;
;11;Косметика;Бальзам для чувствительной кожи;Barbados Naturally Preserved Pure Balm;150 мл;144;Anna lotan;Barbados;783600;1100000;;4144;;(натуральный сок алоэ, масло оливы и жожоба, cimicifuga (клопогон кистевидный), сквалан, экстракт жимолости, витамин Е, молочная кислота). Натуральная эмульсия мгновенно впитывается, успокаивает и увлажняет раздражённую кожу (особенно в Т-зоне) благодаря специально подобранным ингредиентам, максимально защищают кожу от свободных радикалов. Препарат содержит только натуральные консерванты.;;Израиль;;
;12;Косметика;Успокаивающий гель на цветочных экстрактах;Calmessence Soothing Fluid Gel;50 мл;;Anna lotan;Barbados;292900;415000;;030;;(экстракт жимолости, сок алое, масло зародышей пшеницы, экстракт облепихи, вит. Е и А). Нежный с невесомой структурой гель моментально впитывается, оказывает успокаивающее и охлаждающее действие, идеален для ухода за деликатной кожей смешанного типа . В жаркий сезон подходит всем типам кожи, т. к. прекрасно увлажняет, не оставляя ощущения жирности и липкости.;;Израиль;;
;13;Косметика;Успокаивающий гель на цветочных экстрактах;Calmessence Soothing Fluid Gel;100 мл;030;Anna lotan;Barbados;471700;665000;;4030;;(экстракт жимолости, сок алое, масло зародышей пшеницы, экстракт облепихи, вит. Е и А). Нежный с невесомой структурой гель моментально впитывается, оказывает успокаивающее и охлаждающее действие, идеален для ухода за деликатной кожей смешанного типа . В жаркий сезон подходит всем типам кожи, т. к. прекрасно увлажняет, не оставляя ощущения жирности и липкости.;;Израиль;;
;14;Косметика;Увлажняющий крем-мусс;Calming Whipped Cream;75 мл;;Anna lotan;Barbados;292900;415000;;792;;(сок листьев алоэ-вера, вит.Е, экстракт жимолости, хрен, стеариновая кислота, аминокислоты, глюконолактон,, масла лаванды и герани).  Обладает выраженным противозудным и антимикробным действием для ухода за чувствительной жирной кожей с себореей. Крем - мусс идеально подходит подросткам, а также мужчинам для использования после бритья.;;Израиль;;
;15;Косметика;Увлажняющий крем-мусс;Calming Whipped Cream;100 мл;792;Anna lotan;Barbados;395600;555000;;4792;;(сок листьев алоэ-вера, вит.Е, экстракт жимолости, хрен, стеариновая кислота, аминокислоты, глюконолактон,, масла лаванды и герани).  Обладает выраженным противозудным и антимикробным действием для ухода за чувствительной жирной кожей с себореей. Крем - мусс идеально подходит подросткам, а также мужчинам для использования после бритья.;;Израиль;;
;16;Косметика;Эмульсия для локального нанесения;Barbados Ointment;40 мл;;Anna lotan;Barbados;275800;390000;;079;;"(натуральный сок алоэ, экстракты ромашки, литоспермума, пчелиный воск, соли Мертвого моря, салициловая кислота, бисаболол, аллантоин). Дополняет действие увлажняющего крема ""Барбадос"", для локального точечного ухода за деликатной кожей с проблемами (шелушение, покраснение) на Т-участке.";;Израиль;;
;17;Косметика;Маска Барбадос;Barbados Soothing Mask;70 мл;;Anna lotan;Barbados;317600;445000;;246;;(экстракт алоэ, облепихи, жимолости, аллантоин).  Нежная маска для чувствительной  себорейной кожи. Смягчает, увлажняет,  успокаивает раздражения и покраснения.;;Израиль;;
;18;Косметика;Солнцезащитный крем с SPF19 для жирной кожи и нормальной кожи;Protective Daily Moisturizer SPF19;70 мл;;Anna lotan;Barbados;209200;295000;;068;;(алоэ, метоксициннамат, гамамелис, диоксид титана, гидрогенизированное касторовое масло).  Смягчает кожу, обладает  противовоспалительным и заживляющим действием и обеспечивает защиту на длительное время.;;Израиль;;
;19;Косметика;Крем защитный с SPF20;Barbados Natural Sunscreen Lotion SPF 20;50 мл;;Anna lotan;Barbados;285300;400000;;090;;(натуральный сок алоэ, диоксид титана, оксид цинка, масло жожоба, оливы, экстракт жимолости и лиственницы, витамин Е, бисаболол).  Для ежедневного использования для  для чувствительной, склонной к жирности коже.;;Израиль;;
;20;Косметика;Кондиционер для кожи головы;Scalp Soothing Leave-On Conditioner;200 мл;;Anna lotan;Barbados;266200;375000;;066;;(витамин Е, экстракт зеленого чая, глюконолактон, пантенол) Не требует смывания.  . Идеально подходит для чувствительной кожи головы, особенно при сухой и жирной себорее. Улучшает структуру волос, укрепляя и улучшая их внешний вид, припятствует спутыванию. Препарат может использоваться самостоятельно ( применение шампуня не обязательно). ;;Израиль;;
;21;Косметика;Жидкое минеральное мыло для жирной  и проблемной кожи;CLEAR Mineral Liquid Soap;200 мл;;Anna lotan;A-CLEAR ;199700;280000;;023;;(минералы Мертвого Моря, экстракты ромашки, шалфея, зверобоя, тысячелистника). Прекрасно очищает и смягчает кожу. Рекомендуется для нормальной,  жирной и особенно чувствительной кожи.;;Израиль;;
;22;Косметика;Прополисный лосьон для жирной/проблемной кожи лица;Propolis Lotion;200 мл;;Anna lotan;A-CLEAR ;233900;330000;;013;;(прополис, гамамелис, минералы Мертвого моря).   Для жирной, проблемной кожи. Действует на кожу антисептически и регулирует деятельность сальных  желёз, стягивает  поры.  Не содержит спирта.;;Израиль;;
;23;Косметика;"Сыворотка ""Сальвиталь""";Salvital Bio-Peel;125 мл;;Anna lotan;A-CLEAR ;340400;480000;;086;;(вода Мертвого моря, масло жожоба, цитрусовый экстракт). Уникальный препарат без консервантов. Обладает антибактериальными свойствами, отшелушивает ороговевшие чешуйки эпидермиса. Размягчает, осветляет комедоны и замедляет их образование при регулярном употреблении (РН 3.5). Может использоваться для тела. ;;Израиль;;
;24;Косметика;"Кристаллический пилинг ""Ананас""";Ananas Crystal Peeling;60 мл;;Anna lotan;A-CLEAR ;292900;415000;;096;;(жожоба, минералы Мертвого моря, масло календулы, экстракт ананаса).  Идеально очищает эпидермис от ороговевших чешуек, осветляет комедоны, повышает тонус кожи, стягивает поры, улучшает цвет лица.  Удобен и экономичен в использовании.;;Израиль;;
;25;Косметика;"Крем-гель ""Балансер"" для жирной проблемной кожи";A-Clear  Balancer moisturizing emulsion;70 мл;;Anna lotan;A-CLEAR ;226300;320000;;047;;(сок алоэ, экстракт герани, ромашки, гамамелиса, витамин Е).  Используется для увлажнения всех типов кожи, обладает   антиоксидантным действием. Для мужчин рекомендуется как успокаивающий бальзам после бритья. ;;Израиль;;
;26;Косметика;"Маска ""Провит"" для жирной проблемной кожи";Provit Cream Mask;40 мл;;Anna lotan;A-CLEAR ;237700;335000;;153;;"Маска ""Провит"" для жирной проблемной кожи/ Provit Cream Mask  (экстракты  облепихи, зеленого чая, спорыш, эфирное масло мирры, шалфея, тимьяна, сок алоэ, каолин, диоксид титана, альпийский мох).  Маска антисептическая, с восстанавливающей и гигиенической функцией для жирной и проблемной кожи.  Можно использовать  локально.";;Израиль;;
;27;Косметика;Растительный подсушивающий лосьон для жирной кожи;Herbal Drying Lotion;30 мл;;Anna lotan;A-CLEAR ;195900;275000;;010;;(масло шалфея, аллантоин, гамамелис, экстракт эхинацеи, эфирные масла лаванды, тимьяна, минералы Мертвого моря, оксид железа).  Для локального применения. Обладает сильным антисептическим действием, способствует подсушиванию и заживлению кожи, предотвращает распространение бактерий. Можно использовать под макияж. ;;Израиль;;
;28;Косметика;Растительный подсушивающий лосьон для жирной кожи;Herbal Drying Lotion;30 мл;010;Anna lotan;A-CLEAR ;195900;275000;;717;;(масло шалфея, аллантоин, гамамелис, экстракт эхинацеи, эфирные масла лаванды, тимьяна, минералы Мертвого моря, оксид железа).  Для локального применения. Обладает сильным антисептическим действием, способствует подсушиванию и заживлению кожи, предотвращает распространение бактерий. Можно использовать под макияж. ;;Израиль;;
;29;Косметика;Стягивающая маска;Astringent Mud Mask ;60 мл;;Anna lotan;A-CLEAR ;216800;305000;;092;;(грязь Мертвого моря, экстракт гамамелиса, эхинацеи, ромашки, масло мяты перечной, цинк, каолин).  Регулирует деятельность сальных желез, обладает стягивающим, заживляющим и бактерицидным действием, применяется при себорейном дерматите, акне.;;Израиль;;
;30;Косметика;Активизирующая маска с натуральной грязью Мёртвого Моря серии Black Silt; Black Pearl Activating Mask with natural Dead Sea mud;90 мл;;Anna lotan;A-CLEAR ;251000;355000;;767;;(черная грязь Мертвого моря, сок алоэ, яблочный экстракт, граната, хитозан). Прекрасно удаляет избыток себума и очищает кожу, освежает цвет лица, обладает видимым подтягивающим и разглаживающим эффектом.Подходит для всех типов кожи.;;Израиль;;
;31;Косметика;Очищающая пена;Nano-In Foam Purifying Cleansing;50 мл;;Anna lotan;CLEAR;209200;295000;;mal 803;;(протеины пшеницы, минеральная вода Мертвого моря, экстракт камелии, экстракт жимолости,  масло кардамона ,мускатный орех масло, цитрусовые масла, масло пачули ).Нежная очищающая пенка, без ароматизаторов и химических консервантов предназначенна для жирной, проблемной и угреватой кожи. Эффективно очищает, не высушивая кожу. ;;Израиль;;
;32;Косметика;Очищающая пена;Nano-In Foam Purifying Cleansing;150 мл;mal 803;Anna lotan;CLEAR;285300;400000;;803;;(протеины пшеницы, минеральная вода Мертвого моря, экстракт камелии, экстракт жимолости,  масло кардамона ,мускатный орех масло, цитрусовые масла, масло пачули ).Нежная очищающая пенка, без ароматизаторов и химических консервантов предназначенна для жирной, проблемной и угреватой кожи. Эффективно очищает, не высушивая кожу. ;;Израиль;;
;33;Косметика;Минеральный скраб;PEELING;100 мл;;Anna lotan;CLEAR;481200;675000;;809;;(масла жожоба и кокоса, протеины пшеницы, выжимка из алоэ, экстракт гаммамелиса, натуральные сахара).  Препарат для глубокого очищения, идеально подходит для жирной, загрязненной кожи, может эффективно используется  также для всех  типов кожи два-три раза в неделю. ;;Израиль;;
;34;Косметика;Пилинг бустер с АНА-16;BOOSTER Professional Peeling Intenifier AHA 16;125 мл;;Anna lotan;CLEAR;481200;675000;;808;;(молочная кислота, глюконолактон, гликолевая кислота, экстракты иглица, огурец, сок алоэ-вера, полисахариды, производные НУФ и гиалуроновой кислоты, аминокислота глицин и сок листьев алоэ-вера).   Препарат разработан только для профессионального использования!!!  (16%, рН 3,1);;Израиль;;
;35;Косметика;Балансирующая увлажняющая маска;MASK;100 мл;;Anna lotan;CLEAR;391800;550000;;805;;(сок алоэ, лишайник, мед и специальный себокомплекс на основе корицы).  Специально предназначена для жирной и проблемной кожи. Увлажняет, уменьшает покраснения и успокаивает кожу после лечения. ;;Израиль;;
;36;Косметика;"Гель для поддержания гигиены жирной кожи ""Точечный уход""";Nano-In Clear  Dry Touch;50 мл;;Anna lotan;CLEAR;270100;380000;;806;;(экстракт лишайника, мимоза, мирра витамин BS экстракт эхинацеи и тапиока).  Препарат для локального нанесения,  оставляет на   коже  след легкой  пудры,  успокаивает покраснения  и  воспаления  поддерживает  гигиену проблемной кожи. ;;Израиль;;
;37;Косметика;Обезжиренный солнцезащитный гель Оил Фри с SPF32;PROTECTOR Oil Free Sunscreen Gel SPF32;50 мл;;Anna lotan;CLEAR;464000;650000;;804;;Обезжиренный легко впитывающийся гель обеспечивает высокую защиту от УФ-лучей и сводит к минимуму образование пигментных пятен. Гель на спиртовой основе идеально подходит для гигиены жирной кожи. Алоэ Вера и витамин Е обеспечивают успокаивающий эффект и защищают от вредного воздействия солнца.;;Израиль;;
;38;Косметика;Эмульсия очищающая;Alodem Calendula Cleansing Emulsion;200 мл;;Anna lotan;ALODEM;285300;400000;;277 ;;Эмульсия очищающая / Alodem Calendula Cleansing Emulsion. ;;Израиль;;
